{
  "accessed_on": "2026-10-29",
  "bytes": 1634512,
  "id": "source:ldo-app-st-ld1117-r38",
  "license_class": "PUBLIC_REFERENCE",
  "pages": 46,
  "provenance": {
    "created_by": "agent:/root",
    "verified_by": [
      "agent:/root/verify_g1_source_access"
    ]
  },
  "publisher": "STMicroelectronics",
  "revision": "DocID2572 Rev 38",
  "schema": "pcbknowledge.source.v2",
  "sha256": "4fd8415a20d932fdc1de5be99e1aa5d2af1546f05c0a785a047ff93420364348",
  "title": "LD1117 adjustable and fixed regulator datasheet",
  "url": "https://www.st.com/resource/en/datasheet/ld1117.pdf",
  "verification": "AGENT_VERIFIED"
}
