{
  "accessed_on": "2026-10-29",
  "bytes": 383660,
  "id": "source:wurth-61300411121",
  "license_class": "PUBLIC_REFERENCE",
  "pages": 6,
  "provenance": {
    "created_by": "agent:/root/implement_pcbknowledge_brief/curate_g1_parts/curate_g1_mcu_peripherals",
    "verified_by": [
      "agent:/root/implement_pcbknowledge_brief/curate_g1_parts"
    ]
  },
  "publisher": "Würth Elektronik",
  "revision": "003.000 2023-01-08",
  "schema": "pcbknowledge.source.v2",
  "sha256": "ce759fb8caee2fd0c3167f6925010f6703aa4f939ded51aae7ead334c38c0d7d",
  "title": "WR-PHD 61300411121 pin header",
  "url": "https://www.we-online.com/components/products/datasheet/61300411121.pdf",
  "verification": "AGENT_VERIFIED"
}
