{
  "accessed_on": "2026-10-29",
  "bytes": 1535935,
  "id": "source:abracon-abm8",
  "license_class": "PUBLIC_REFERENCE",
  "pages": 2,
  "provenance": {
    "created_by": "agent:/root/implement_pcbknowledge_brief/curate_g1_parts/curate_g1_mcu_peripherals",
    "verified_by": [
      "agent:/root/implement_pcbknowledge_brief/curate_g1_parts"
    ]
  },
  "publisher": "Abracon",
  "revision": "07-29-20",
  "schema": "pcbknowledge.source.v2",
  "sha256": "564ac331d8bf38b4ae1222444b0d9cfea3a6ba29148a8be906b2e0ffe40471d8",
  "title": "ABM8 ceramic SMD crystal",
  "url": "https://abracon.com/Resonators/abm8.pdf",
  "verification": "AGENT_VERIFIED"
}
