{
  "accessed_on": "2026-10-29",
  "bytes": 56349,
  "id": "source:yageo-rc0603fr-0710rl",
  "license_class": "PUBLIC_REFERENCE",
  "pages": 1,
  "provenance": {
    "created_by": "agent:/root/implement_pcbknowledge_brief/curate_g1_parts",
    "verified_by": [
      "agent:/root/implement_pcbknowledge_brief/curate_g1_parts/curate_g1_mcu_peripherals"
    ]
  },
  "publisher": "Yageo",
  "revision": "Generated 2026-10-29",
  "schema": "pcbknowledge.source.v2",
  "sha256": "a5b5f22f74548cc88b20e0e5cbb40e68cf945d0b1273a212978e73d7d641fe84",
  "title": "RC0603FR-0710RL component specification",
  "url": "https://www.yageogroup.com/component-documentation/download/specsheet/RC0603FR-0710RL",
  "verification": "AGENT_VERIFIED"
}
