{
  "accessed_on": "2026-10-29",
  "bytes": 112794,
  "id": "source:amphenol-10155435",
  "license_class": "PUBLIC_REFERENCE",
  "pages": 1,
  "provenance": {
    "created_by": "agent:/root/implement_pcbknowledge_brief/curate_g1_parts/curate_g1_mcu_peripherals",
    "verified_by": [
      "agent:/root"
    ]
  },
  "publisher": "Amphenol FCI",
  "revision": "C 2020-07-30",
  "schema": "pcbknowledge.source.v2",
  "sha256": "f25fc7d320894a3caf603fa839265a264576e9abe5a602dc6a64318b18d29e9d",
  "title": "10155435 USB Type C female right-angle SMT16pin",
  "url": "https://cdn.amphenol-cs.com/media/wysiwyg/files/drawing/10155435.pdf",
  "verification": "AGENT_VERIFIED"
}
